id,position,about,combined
tomasz-kaleta-883821187,trainer system integration technicians asml,graduate technical bachelor degree hbo cracow university technology specialization systems transport equipment career started technologist designing parts autocad suspended locomotive intended work underground mines improved skills programs process engineer company producing hoses air conditioning cars january moving netherlands new chapter life new challenges gained great experience tesla factory tilburg amazing atmosphere really learned teamwork also pleasure participating twoweek delegation norway next step job tobroco giant absorbing knowledge mechanics hydraulics electrics systems currently working technician duv nxt systems asml yearold engineer waiting next challenges,trainer system integration technicians asml graduate technical bachelor degree hbo cracow university technology specialization systems transport equipment career started technologist designing parts autocad suspended locomotive intended work underground mines improved skills programs process engineer company producing hoses air conditioning cars january moving netherlands new chapter life new challenges gained great experience tesla factory tilburg amazing atmosphere really learned teamwork also pleasure participating twoweek delegation norway next step job tobroco giant absorbing knowledge mechanics hydraulics electrics systems currently working technician duv nxt systems asml yearold engineer waiting next challenges
francois-marais-5a026742,owner,development workplace health safety systems project management,owner development workplace health safety systems project management
alan-queiroz-208841116,analyst plenary ti,digitalize proximity,analyst plenary ti digitalize proximity
mirco-cantelli-9b133b6,cmo,arrogance success think yesterday sufficient tomorrow thats strongly believe time overtake prejudice manager coming business required job position somebody understands different work experiences different businesses means open mind make difference easier generating durable competitive advantages investorpresidentboss im looking im engineer economist study teach climate change spent years managing museums exhibitions im therefore fully convinced digital humanities new technologies applied heritage ciurcular economy key drivers next years businesslife love books two favourite authors milan kundera business two functions marketing innovation mrs j k rowling imagination capacity envision power enables us empathize humans whose experiences never shared innovation dna people keep confuse innovation efficiency innovation mental attitude nothing many rd dollars invest apple came mac ibm spending times rd ibm later simply disappeared best play role strategy coach departments providing much needed support formulation individual department strategies support group towards strategic objectives ensure group complied best practices formulate strategy collaborating stakeholders leading crossfunctional teams development groupwide operational strategies prefer maintain ownership strategic plans ensure compliance strategies review manage analyze existing business strategies order ensure alignment overall strategy continuosly assist departmental managers driving optimizing improvement key value levers result sustainable competitive advantage analyze longterm market trends purpose providing recommendations board regard business development opportunities inclusive im enjoying work private public sectors love real challenges something good love something outstanding good thats great love succes group success becomes comopany community people cityzens success,cmo arrogance success think yesterday sufficient tomorrow thats strongly believe time overtake prejudice manager coming business required job position somebody understands different work experiences different businesses means open mind make difference easier generating durable competitive advantages investorpresidentboss im looking im engineer economist study teach climate change spent years managing museums exhibitions im therefore fully convinced digital humanities new technologies applied heritage ciurcular economy key drivers next years businesslife love books two favourite authors milan kundera business two functions marketing innovation mrs j k rowling imagination capacity envision power enables us empathize humans whose experiences never shared innovation dna people keep confuse innovation efficiency innovation mental attitude nothing many rd dollars invest apple came mac ibm spending times rd ibm later simply disappeared best play role strategy coach departments providing much needed support formulation individual department strategies support group towards strategic objectives ensure group complied best practices formulate strategy collaborating stakeholders leading crossfunctional teams development groupwide operational strategies prefer maintain ownership strategic plans ensure compliance strategies review manage analyze existing business strategies order ensure alignment overall strategy continuosly assist departmental managers driving optimizing improvement key value levers result sustainable competitive advantage analyze longterm market trends purpose providing recommendations board regard business development opportunities inclusive im enjoying work private public sectors love real challenges something good love something outstanding good thats great love succes group success becomes comopany community people cityzens success
melanie-williams-14899539,workforce development leadership,passionate leader coach heart experienced workforce developmentcareer training human resources managementeducation bachelor science saint marys university mn major human services human resources management,workforce development leadership passionate leader coach heart experienced workforce developmentcareer training human resources managementeducation bachelor science saint marys university mn major human services human resources management
%E6%99%93%E9%B9%8F-%E9%AD%8F-635163191,sensetime software development engineer,present familiar docker kubernetes,sensetime software development engineer present familiar docker kubernetes
randy-holliday-4ab52b29,warehousing professional,great organization skills customer service communication management skills im motivated personable hard working business professional diplomatic tactful professionals nonprofessionals levels accustomed handling sensitive confidential records demonstrated history processing jobs time limitations ability provide instruction conveying information providing immediate feedback ability act liaison managers various teams flexible versatile able maintain sense humor pressure poised competent demonstrated ability easily transcend cultural differences thrive deadlinedriven environments excellent teambuilding skills specialties management skills visual management team management forklift experience certified instructor receiving duties product rotation,warehousing professional great organization skills customer service communication management skills im motivated personable hard working business professional diplomatic tactful professionals nonprofessionals levels accustomed handling sensitive confidential records demonstrated history processing jobs time limitations ability provide instruction conveying information providing immediate feedback ability act liaison managers various teams flexible versatile able maintain sense humor pressure poised competent demonstrated ability easily transcend cultural differences thrive deadlinedriven environments excellent teambuilding skills specialties management skills visual management team management forklift experience certified instructor receiving duties product rotation
sarahjhodson,recruitment coordinator food clothing home talent acquisition marks spencer making everyday remarkable sarahhodsonmarksandspencercom,ms focus relentlessly delivering top quality products customers much never changed attention detail passion improvement led creation nations loved products world changing fast changing ms transforming become relevant often existing customers appeal new ones setting bolder goals giving people space resources achieve ms food team seriously love food colleagues passionate protecting magic foods given pace scale change ms never exciting time join us recruitment coordinator absolute joy help bring top talent business,recruitment coordinator food clothing home talent acquisition marks spencer making everyday remarkable sarahhodsonmarksandspencercom ms focus relentlessly delivering top quality products customers much never changed attention detail passion improvement led creation nations loved products world changing fast changing ms transforming become relevant often existing customers appeal new ones setting bolder goals giving people space resources achieve ms food team seriously love food colleagues passionate protecting magic foods given pace scale change ms never exciting time join us recruitment coordinator absolute joy help bring top talent business
markdidolci,senior health advisor veteran,strategic results oriented consultant years business development sales experience within real estate health life insurance industries skilled linking marketing sales functions within matrix organization,senior health advisor veteran strategic results oriented consultant years business development sales experience within real estate health life insurance industries skilled linking marketing sales functions within matrix organization
robertbpowell,voip sdwan cloud cyber security fiber optic coax cable,awardwinning topranking sales manager producer history delivering impressive revenue gains strategic sales leadership consultativesolutions selling strengths technologytelecom industry dedicated motivated professional diverse background sales management staff development organizational leadership able facilitate profitable relationships wide range clients key business partners,voip sdwan cloud cyber security fiber optic coax cable awardwinning topranking sales manager producer history delivering impressive revenue gains strategic sales leadership consultativesolutions selling strengths technologytelecom industry dedicated motivated professional diverse background sales management staff development organizational leadership able facilitate profitable relationships wide range clients key business partners
michel-schoonen-959b792a,multicolour offset printer npn drukkers,fullyfledged graphic artist graduated dtp multicolour offset experience range printing presses small large formats printer commercial sense thoughtful eager learn way develop completely possible terms order flow team spirit addition technical side printing,multicolour offset printer npn drukkers fullyfledged graphic artist graduated dtp multicolour offset experience range printing presses small large formats printer commercial sense thoughtful eager learn way develop completely possible terms order flow team spirit addition technical side printing
sankarshan1993,software development manager amazon,seek opportunity focused research development work enhances skills also provides necessary exposure improving analytic technical skills self proclaimed apple fan dabbled hands ios mac app development initial years java heartbeat swear right school life kolkata actively working various java technologies end first year also training ibm various java technologies cloud computing second year hacking bug bit mainly access wifi restricted places poor security course isoeh indian school ethical hacking ethical hacking enhance knowledge third year got internship amazon india put supply chain optimisation technologies scot team main job make software calculate amount influx goods using machine learning techniques much needed keep warehouses along robust notification service work basically involved java also got exposed spring framework due rigorous testing procedures got familiar almost testing frameworks mockito powermock easymock essential robust software also got exposed lot open source frameworks developed amazon due satisfactory performance offered ppo preplacement offer amazon india final year college part three research projects dr mamata dalui design coherence solution clustered cache hierarchies design cache eviction policy last level cache management graphical interface viewing explicit rule vector graphs also team player open suggestions insights everyone feel free contact linkedin drop mail sankarshanmecom sankarshanpurkayasthagmailcom,software development manager amazon seek opportunity focused research development work enhances skills also provides necessary exposure improving analytic technical skills self proclaimed apple fan dabbled hands ios mac app development initial years java heartbeat swear right school life kolkata actively working various java technologies end first year also training ibm various java technologies cloud computing second year hacking bug bit mainly access wifi restricted places poor security course isoeh indian school ethical hacking ethical hacking enhance knowledge third year got internship amazon india put supply chain optimisation technologies scot team main job make software calculate amount influx goods using machine learning techniques much needed keep warehouses along robust notification service work basically involved java also got exposed spring framework due rigorous testing procedures got familiar almost testing frameworks mockito powermock easymock essential robust software also got exposed lot open source frameworks developed amazon due satisfactory performance offered ppo preplacement offer amazon india final year college part three research projects dr mamata dalui design coherence solution clustered cache hierarchies design cache eviction policy last level cache management graphical interface viewing explicit rule vector graphs also team player open suggestions insights everyone feel free contact linkedin drop mail sankarshanmecom sankarshanpurkayasthagmailcom
avinash-agarwal-47124223,associate director intelligent spend management pwc india,sap mm ariba functional sme founding member ariba practice pwc anchoring sales pan india worked ariba implementation upstreamdownstream modules helped client functional design scope requirement gathering template design testing go live support deliver ariba implementations lead team responding including solutioning rfp proposal bd tor ariba related opportunities tools exposure sap ariba sourcing contracts slp supplier discovery pp,associate director intelligent spend management pwc india sap mm ariba functional sme founding member ariba practice pwc anchoring sales pan india worked ariba implementation upstreamdownstream modules helped client functional design scope requirement gathering template design testing go live support deliver ariba implementations lead team responding including solutioning rfp proposal bd tor ariba related opportunities tools exposure sap ariba sourcing contracts slp supplier discovery pp
adamtarbox,systems engineer iiitechnical lead nasa intergrated communication systems,resultsdriven professional experience providing customerfocused technical assistance training clients new software applications development new efficient ways business skilled providing functions purchasing installation administration experienced liaison hardware vendorssupport avenues enduser develop standards adhere best practices research emerging technologies recommend hardware software products improve effectiveness efficiency technology clients specialties vsphere windows r r server windows r r active directory exchange ecp lanwan configuration cisco switches vlan configuration windows previous platforms ticketing system use imaging software terminate cat stputp cable quotesconfiguration purchases ms office creation standards consistency various linux platforms researchbeta testing softwarehardware mac osx variations netwareups citrix environment lan printer configuration printer queue setup wireless networkmobile device configuration networktelecom cabling project management user account management scopessubnets polycom vtc system vendor realtions,systems engineer iiitechnical lead nasa intergrated communication systems resultsdriven professional experience providing customerfocused technical assistance training clients new software applications development new efficient ways business skilled providing functions purchasing installation administration experienced liaison hardware vendorssupport avenues enduser develop standards adhere best practices research emerging technologies recommend hardware software products improve effectiveness efficiency technology clients specialties vsphere windows r r server windows r r active directory exchange ecp lanwan configuration cisco switches vlan configuration windows previous platforms ticketing system use imaging software terminate cat stputp cable quotesconfiguration purchases ms office creation standards consistency various linux platforms researchbeta testing softwarehardware mac osx variations netwareups citrix environment lan printer configuration printer queue setup wireless networkmobile device configuration networktelecom cabling project management user account management scopessubnets polycom vtc system vendor realtions
laura-kaplan-lcsw-90687314,mental health clinician great starts,social worker training know takes efforts entire community ensure people connected children grow healthy families parents provide secure homes throughout career privileged connecting families resources communities members community opportunities help support children live healthy lives goal continue work role take career specialties medical social work child family therapy case management supervision volunteer recruitment fiscal management creative program development state federal grant management board development publicprivate partnerships social policy,mental health clinician great starts social worker training know takes efforts entire community ensure people connected children grow healthy families parents provide secure homes throughout career privileged connecting families resources communities members community opportunities help support children live healthy lives goal continue work role take career specialties medical social work child family therapy case management supervision volunteer recruitment fiscal management creative program development state federal grant management board development publicprivate partnerships social policy
lauramurach,research professional limra intelligence analyst insurance independent distribution,researcher insurance financial services industry im proud play role business helps individuals lifechanging events helping people makes job exciting fulfilling every day get work numbers data discover insights help support member companies love thinking outside box learning new things teaching others supporting industry meeting new people things im good im working im sharing musical talents church family small community choir last year annual concert raised almost medical clinic nigeria raised enough funds support medical care people one week thats awesome,research professional limra intelligence analyst insurance independent distribution researcher insurance financial services industry im proud play role business helps individuals lifechanging events helping people makes job exciting fulfilling every day get work numbers data discover insights help support member companies love thinking outside box learning new things teaching others supporting industry meeting new people things im good im working im sharing musical talents church family small community choir last year annual concert raised almost medical clinic nigeria raised enough funds support medical care people one week thats awesome
james-bowe-26a6515,partner king spalding,law practice deals energy sector regulation energyrelated transactional matters energy project development financing privatization north south america middle east europe africa counseled clients project development matters commercial negotiations mergers acquisitions dispositions energy sector reorganizations us international transactions involving assets companies produce transmit store natural gas liquefied natural gas petroleum petrochemicals electric power renewable energy hydrogen alternative energy sources well companies engaged waterwastewater district cooling sectors clients include public investorowned utilities industrial enterprises natural gas electricity marketers energy pipelines storage operators local distribution companies independent power producers financial institutions investors governments acted us canadian federal regulatory proceedings involving permitting construction pipeline storage electric generation projects counsel financial institutions project developers connection us international energy project financings assisted negotiation documentation energy supply transportation storage arrangements handled sales purchases ownership interests energy pipeline storage facilities development permitting expansion dozen highperformance natural gas storage projects sale energy trading books evaluation electric generating facility portfolios potential purchase reviews energy companies compliance federal energy regulatory commission regulations reorganization one largest gas electric utilities north america bankruptcy code outsourcing electricity distribution water distribution wastewater operations middle east development regulatory regime governing district cooling middle east specialties natural gas ngls oil petrochemicals storage pipeline project development lng project development energy facility permitting construction energy asset purchases dispositions federal energy regulatory commission department energy compliance matters negotiation documentation energy sector commercial contracts energy project finance,partner king spalding law practice deals energy sector regulation energyrelated transactional matters energy project development financing privatization north south america middle east europe africa counseled clients project development matters commercial negotiations mergers acquisitions dispositions energy sector reorganizations us international transactions involving assets companies produce transmit store natural gas liquefied natural gas petroleum petrochemicals electric power renewable energy hydrogen alternative energy sources well companies engaged waterwastewater district cooling sectors clients include public investorowned utilities industrial enterprises natural gas electricity marketers energy pipelines storage operators local distribution companies independent power producers financial institutions investors governments acted us canadian federal regulatory proceedings involving permitting construction pipeline storage electric generation projects counsel financial institutions project developers connection us international energy project financings assisted negotiation documentation energy supply transportation storage arrangements handled sales purchases ownership interests energy pipeline storage facilities development permitting expansion dozen highperformance natural gas storage projects sale energy trading books evaluation electric generating facility portfolios potential purchase reviews energy companies compliance federal energy regulatory commission regulations reorganization one largest gas electric utilities north america bankruptcy code outsourcing electricity distribution water distribution wastewater operations middle east development regulatory regime governing district cooling middle east specialties natural gas ngls oil petrochemicals storage pipeline project development lng project development energy facility permitting construction energy asset purchases dispositions federal energy regulatory commission department energy compliance matters negotiation documentation energy sector commercial contracts energy project finance
emilianorezende,value advisory director intelligent spend business network sap ariba fieldglass,professional aims improve procurement skills along companys growth efficiency seven years experience procurement logistic including five years dedicated vale sa experiences purchasing hiring domestic foreign markets developing local suppliers kpis sla support development technical specifications services hiring along operational areas also preparation management reports foreign trade routines logistic contract management experience abroad five years,value advisory director intelligent spend business network sap ariba fieldglass professional aims improve procurement skills along companys growth efficiency seven years experience procurement logistic including five years dedicated vale sa experiences purchasing hiring domestic foreign markets developing local suppliers kpis sla support development technical specifications services hiring along operational areas also preparation management reports foreign trade routines logistic contract management experience abroad five years
camilla-norinder,buyer private label grazette sweden ab,basic design education solid purchasing experience burning interest idea sale finished product enjoys supplier contact making sure product delivered ordered methodical unprestigious meticulous responsible easy collaborate great interest fashion trends adapted given target group,buyer private label grazette sweden ab basic design education solid purchasing experience burning interest idea sale finished product enjoys supplier contact making sure product delivered ordered methodical unprestigious meticulous responsible easy collaborate great interest fashion trends adapted given target group
