id,position,about,combined
hassan-saad-23986325,consultancy market entry brand building marketing trade marketing excellence execution business planning commercial operational strategies business development offshore sal,offering yrs experience fmcg space within africa regions managing distributors operating distribution businesses handling bb bc modern trade traditional trade horeca pharma beauty salons e comm channels planning applying world class category channel management strategies deliver sustainable growth developing private labels regional global brands covering wide spectrum categories snacks confectionery bakeries pastries frozen products dairy products commodities processed food alcoholic non alc beverages tobacco detergents insecticides cosmetics personal care baby care light household categories light medical devices recognized best practice knowledge customercentric thinking constructive approach collaborative work ethics drive results stakeholders involved team player motivational leader excellent interpersonal communication skills strive deliver excellence operational performance efficiency improvement effective sop management solid aops planning regular performance reviews mastering route market optimizing value chain effective customer service policies trade terms management focus heavily leveraging firmbrand key strengths core competency materialize business opportunities successful track record developing relationships among franchiseesdistributors subd mt key accounts marketing communication agencies,consultancy market entry brand building marketing trade marketing excellence execution business planning commercial operational strategies business development offshore sal offering yrs experience fmcg space within africa regions managing distributors operating distribution businesses handling bb bc modern trade traditional trade horeca pharma beauty salons e comm channels planning applying world class category channel management strategies deliver sustainable growth developing private labels regional global brands covering wide spectrum categories snacks confectionery bakeries pastries frozen products dairy products commodities processed food alcoholic non alc beverages tobacco detergents insecticides cosmetics personal care baby care light household categories light medical devices recognized best practice knowledge customercentric thinking constructive approach collaborative work ethics drive results stakeholders involved team player motivational leader excellent interpersonal communication skills strive deliver excellence operational performance efficiency improvement effective sop management solid aops planning regular performance reviews mastering route market optimizing value chain effective customer service policies trade terms management focus heavily leveraging firmbrand key strengths core competency materialize business opportunities successful track record developing relationships among franchiseesdistributors subd mt key accounts marketing communication agencies
ann-louise-terkildsen-817b24152,barcelona barcelona,nurse guidance instrumental nursing sterile techniques structured work procedures,barcelona barcelona nurse guidance instrumental nursing sterile techniques structured work procedures
rosemarymendez,customer experience manager executive master business analytics passionate digital transformation,bilingual customer experience manager executive master business analytics certification negotiation count years international experience paas project management frontline customer success managing postsales relationships mainly bc strategic accounts team training retail education industry passionate putting knowledge experience service people contact facilitate customer journey ultimately help reach goals experience collaborating remotely multidisciplinary team international customers located mostly us australia europe singapore south africa throughout career using background engineering implemented projects crm platforms digital marketing worked closely internal teams provide continuous feedback improve commercial area,customer experience manager executive master business analytics passionate digital transformation bilingual customer experience manager executive master business analytics certification negotiation count years international experience paas project management frontline customer success managing postsales relationships mainly bc strategic accounts team training retail education industry passionate putting knowledge experience service people contact facilitate customer journey ultimately help reach goals experience collaborating remotely multidisciplinary team international customers located mostly us australia europe singapore south africa throughout career using background engineering implemented projects crm platforms digital marketing worked closely internal teams provide continuous feedback improve commercial area
beulahdavies,board member australian institute professional intelligence officers aipio,beulah passionate science behavioural profiling power enhance performance create collaborate high performing teams effective leaders beulah uses proven methodologies disc meta dynamics including critical thinking model fast track business success though leveraging caring greatest asset people contact beulah today discuss work together improve team dynamics communication build effective relationships work rise leadership potential increase employee engagement maximise productivity potential people beulah accredited consultant extended disc behavioural profiling professionally trained human behaviour performance coach certified practitioner meta dynamics also practitioner nlp degree criminology majoring human behaviour discuss profiling assist team enhance performance business success contact beulah today beulahprofilingforperformancecomau call,board member australian institute professional intelligence officers aipio beulah passionate science behavioural profiling power enhance performance create collaborate high performing teams effective leaders beulah uses proven methodologies disc meta dynamics including critical thinking model fast track business success though leveraging caring greatest asset people contact beulah today discuss work together improve team dynamics communication build effective relationships work rise leadership potential increase employee engagement maximise productivity potential people beulah accredited consultant extended disc behavioural profiling professionally trained human behaviour performance coach certified practitioner meta dynamics also practitioner nlp degree criminology majoring human behaviour discuss profiling assist team enhance performance business success contact beulah today beulahprofilingforperformancecomau call
adrian-maniatis-71ab44a9,senior software engineer crowdstrike,senior malware analyst experience defending sophisticated targeted cyber intrusions heavy focus development tools systems support automation malware analysis core skills python javascript c development software reverse engineering malware analysis automation windows os internals,senior software engineer crowdstrike senior malware analyst experience defending sophisticated targeted cyber intrusions heavy focus development tools systems support automation malware analysis core skills python javascript c development software reverse engineering malware analysis automation windows os internals
danielle-ripper-3360b51a0,loyola college catholic education,hi im danielle currently studying process searching work fulltime parttime casual incredibly eager learn expand knowledge every field work past working experiences taught think differently greatly improved interpersonal peopleskills allowed go beyond excel area ive fortunate work,loyola college catholic education hi im danielle currently studying process searching work fulltime parttime casual incredibly eager learn expand knowledge every field work past working experiences taught think differently greatly improved interpersonal peopleskills allowed go beyond excel area ive fortunate work
trent-bullivant-56168795,lng operator newcastle gas storage facility,experienced eeha inspector iecex certified including ei quality assurancequality control qaqc roles oil gas exposure australia korea norway project shutdown works including lng plant refineries upstream csg infrastructure wells compression stations offshore installations experienced precommissioning commissioning building permits construction roles well maintenance plant equipment live facilities strict permit controls procedures licensed industrial electrician nsw wa nt iecexcertified iecex cp sir iecex cp trnr certificate iii process plant operations certificate iv hazardous areas hazardous areas certificate certificate iv electrical instrumentation certificate iii instrumentation control certificate iv industrial electronics control provide first aid low voltage rescue work safely heights enter work confined spaces confined spaces reacue gas testing atmospheres national high risk ewp licence gyrolok training course bosiet msic issow level,lng operator newcastle gas storage facility experienced eeha inspector iecex certified including ei quality assurancequality control qaqc roles oil gas exposure australia korea norway project shutdown works including lng plant refineries upstream csg infrastructure wells compression stations offshore installations experienced precommissioning commissioning building permits construction roles well maintenance plant equipment live facilities strict permit controls procedures licensed industrial electrician nsw wa nt iecexcertified iecex cp sir iecex cp trnr certificate iii process plant operations certificate iv hazardous areas hazardous areas certificate certificate iv electrical instrumentation certificate iii instrumentation control certificate iv industrial electronics control provide first aid low voltage rescue work safely heights enter work confined spaces confined spaces reacue gas testing atmospheres national high risk ewp licence gyrolok training course bosiet msic issow level
barry-fitzpatrick-work-33727489,production manager arbortech,highly motivated reliable honest hard working knowledgeable skilled enjoy challenges,production manager arbortech highly motivated reliable honest hard working knowledgeable skilled enjoy challenges
mehulpajwani,mechanical engineer,highly skilled mechanical engineer ten years industry experience strong working focus construction commissioning operational conditions including production mining oil gas lng plants dedicated safety approach welldeveloped skill sets facets project management excellent experience onsite supervision various capex projects stakeholder engagement levels daily basis,mechanical engineer highly skilled mechanical engineer ten years industry experience strong working focus construction commissioning operational conditions including production mining oil gas lng plants dedicated safety approach welldeveloped skill sets facets project management excellent experience onsite supervision various capex projects stakeholder engagement levels daily basis
laura-nicolay,bachelors degree tourism leisure management,student tourism leisure management like carry new projects always open taking challenges passionate ambitious convince place team,bachelors degree tourism leisure management student tourism leisure management like carry new projects always open taking challenges passionate ambitious convince place team
mariateresa-e-6694b497,elementary school teacher miur,teacher schoolprofessional educator,elementary school teacher miur teacher schoolprofessional educator
sinclairjack,game design lead two bulls,game designer expertise live services systems design extensive experience writing design documentation large features leading teams implementation final release quick learner lifelong passion video games,game design lead two bulls game designer expertise live services systems design extensive experience writing design documentation large features leading teams implementation final release quick learner lifelong passion video games
james-egan-b5b5613b,bucket lister,career sales management professional pride empathetic selling style clients ability build long term relationships based integrity result time spent boardroomworkshop mid tier level versatility adaptability proactive thinking planning become second nature customer focus integrity service paramount business dealings international experience corporate government also featuring significantly skill base,bucket lister career sales management professional pride empathetic selling style clients ability build long term relationships based integrity result time spent boardroomworkshop mid tier level versatility adaptability proactive thinking planning become second nature customer focus integrity service paramount business dealings international experience corporate government also featuring significantly skill base
shatha-aljohani-637909220,english language graduate,harnessing strong sense responsibility dedication work strong motivation work benefiting qualifications skills courses possess serving developing work,english language graduate harnessing strong sense responsibility dedication work strong motivation work benefiting qualifications skills courses possess serving developing work
mmihelcichomes,real estate broker cisler associates real estate inc,specialties buyers agent listing agent landlord million dollars worth real estate transactions actively engages online marketing techniques implements latest virtual tour technology means buyers sellers view homes virtually degree viewing innovative proactive current member greater gateway association realtors national association realtors illinois association realtors maris mls represents buyers sellers residences southern macoupin county area madison county including helping homeowners wishing sell home actively involved community activities staunton chamber commerce member national eagle scout association,real estate broker cisler associates real estate inc specialties buyers agent listing agent landlord million dollars worth real estate transactions actively engages online marketing techniques implements latest virtual tour technology means buyers sellers view homes virtually degree viewing innovative proactive current member greater gateway association realtors national association realtors illinois association realtors maris mls represents buyers sellers residences southern macoupin county area madison county including helping homeowners wishing sell home actively involved community activities staunton chamber commerce member national eagle scout association
mwato,associate track rail ops modelling mieaust cpeng ner rpev,mark watson chartered professional civil engineer fifteen years experience design documentation management rail infrastructure projects currently track designer maryborough junction acciona rail smec alliance recently awarded stage murray basin rail project part regional rail revival projects victoria involves using track design tool power rail track dual gauge turnout centreline geometry survey tieins well support nsw rail track team alignment design national transport logistics team rail ops modellingplanning previous role systra anz managing performance verification cross river rail etcs l cab signalling brisbane inner city network hitachi sts involved using rail operations modelling tools railsys opentrack working closely designers develop designs meet performance requirements marks journey started career rail industry ric business analyst completion bachelor business end bachelor engineering mid mark years work experience track alignment design including transit space assessment years rail operations modelling last years including years experience completing b engineering degree addition b business degree marks work study history summarised follows rail infrastructure corporation b bus wt consulting leadership training delkor rail ghd undergraduate civil ghd rail engineer tfnsw freight modeller smec senior engineer rail systra performance modeller current smec associate engineer rail,associate track rail ops modelling mieaust cpeng ner rpev mark watson chartered professional civil engineer fifteen years experience design documentation management rail infrastructure projects currently track designer maryborough junction acciona rail smec alliance recently awarded stage murray basin rail project part regional rail revival projects victoria involves using track design tool power rail track dual gauge turnout centreline geometry survey tieins well support nsw rail track team alignment design national transport logistics team rail ops modellingplanning previous role systra anz managing performance verification cross river rail etcs l cab signalling brisbane inner city network hitachi sts involved using rail operations modelling tools railsys opentrack working closely designers develop designs meet performance requirements marks journey started career rail industry ric business analyst completion bachelor business end bachelor engineering mid mark years work experience track alignment design including transit space assessment years rail operations modelling last years including years experience completing b engineering degree addition b business degree marks work study history summarised follows rail infrastructure corporation b bus wt consulting leadership training delkor rail ghd undergraduate civil ghd rail engineer tfnsw freight modeller smec senior engineer rail systra performance modeller current smec associate engineer rail
paulsoftware,senior full stack javascript developer tracecomms,years experience vast number areas within software development industry past years ive shifted focus web technologies particular emphasis frontendclientside development ie xhtml css particular shaping somewhat javascript guru great deal experience technical side things coding delphi sql html css javascript name varied technlogieslanguages experience well business analysis project product management retail supply chain point sale sectors one thing truly triggers interest nowadays pushing boundaries clientside web development javascript engineering without robust standardscompliant working knowledge xhtml css much javascripts output would invisible javascript much underrated misunderstood great number developers understood used properly elegant robust scalable flexible language lot power aim javascript push things spreadtheword speak correct ways develop js unleash potential specialties retail financial services media social media industries agile project managementlead scrumkanbanlean agile process facilitation business analysis offshoringoutsourcing consultancy training multitier serviceoriented application architecture design development javascript css html application web application framework architecture design talent acquisition training mentoring c aspnet mvc dephi web design development specialising best practice javascript ajax development secure crossdomain communications,senior full stack javascript developer tracecomms years experience vast number areas within software development industry past years ive shifted focus web technologies particular emphasis frontendclientside development ie xhtml css particular shaping somewhat javascript guru great deal experience technical side things coding delphi sql html css javascript name varied technlogieslanguages experience well business analysis project product management retail supply chain point sale sectors one thing truly triggers interest nowadays pushing boundaries clientside web development javascript engineering without robust standardscompliant working knowledge xhtml css much javascripts output would invisible javascript much underrated misunderstood great number developers understood used properly elegant robust scalable flexible language lot power aim javascript push things spreadtheword speak correct ways develop js unleash potential specialties retail financial services media social media industries agile project managementlead scrumkanbanlean agile process facilitation business analysis offshoringoutsourcing consultancy training multitier serviceoriented application architecture design development javascript css html application web application framework architecture design talent acquisition training mentoring c aspnet mvc dephi web design development specialising best practice javascript ajax development secure crossdomain communications
john-hughes-b366473a,hi due circumstances beyond control looking new role would appreciate support thank advance connections advice opportunities offer opentowork,sales industry professional vast experience sales management value virtues honesty integrity loyalty feel free contact anytime johnjjhmecom detailed work profile available view seekcomau thank,hi due circumstances beyond control looking new role would appreciate support thank advance connections advice opportunities offer opentowork sales industry professional vast experience sales management value virtues honesty integrity loyalty feel free contact anytime johnjjhmecom detailed work profile available view seekcomau thank
sarah-culverhouse-a6021a10,head education mcphersons health,dedicated educating integrative complementary medicine fusion health oriental botanicals mining wealth knowledge traditional herbal medicine combining insights scientific investigation privilege contribute health many people choose look us healthcare solutions,head education mcphersons health dedicated educating integrative complementary medicine fusion health oriental botanicals mining wealth knowledge traditional herbal medicine combining insights scientific investigation privilege contribute health many people choose look us healthcare solutions
brianjdee,team lead infrastructure operations life line screening,dynamic motivated professional proven record generating building relationships managing projects concept completion designing informational technology strategies coaching individuals success skilled building crossfunctional teams demonstrating exceptional communication skills making critical decisions challenges adaptable transformational leader ability work independently creating effective presentations developing opportunities establish organizational goals goals achieve knowledge experience career applying knowledge business infrastructure enhance productivity efficiency,team lead infrastructure operations life line screening dynamic motivated professional proven record generating building relationships managing projects concept completion designing informational technology strategies coaching individuals success skilled building crossfunctional teams demonstrating exceptional communication skills making critical decisions challenges adaptable transformational leader ability work independently creating effective presentations developing opportunities establish organizational goals goals achieve knowledge experience career applying knowledge business infrastructure enhance productivity efficiency
priya-tiwari-94b176a0,experience years agile manual tester istqb certification,test engineer perform stlc phase includes test designingwriting test cases scenarios neededtest executionsmokesanityblack box testing bug loggingfor bug logging basically use jira tool previously used watson express whose ui somewhat like bugzilla tool test management well jira toolso perform bug life cycle bug get fixed perform retesting well regression testing performed us end bug life cycle test environment changed new features added applicationother also use adobe specific tool known alite tool project test cases writtenbug logged,experience years agile manual tester istqb certification test engineer perform stlc phase includes test designingwriting test cases scenarios neededtest executionsmokesanityblack box testing bug loggingfor bug logging basically use jira tool previously used watson express whose ui somewhat like bugzilla tool test management well jira toolso perform bug life cycle bug get fixed perform retesting well regression testing performed us end bug life cycle test environment changed new features added applicationother also use adobe specific tool known alite tool project test cases writtenbug logged
