id,position,about,combined
nicolas-duvernois-928aa816,manager digitalization co energy saving faurecia,experienced manager demonstrated history working automotive industry skilled international project management embedded software microsoft word failure mode effects analysis fmea quality management engineering master grades ensta paris tech ifp school mba groupe ecole suprieure de commerce et de management,manager digitalization co energy saving faurecia experienced manager demonstrated history working automotive industry skilled international project management embedded software microsoft word failure mode effects analysis fmea quality management engineering master grades ensta paris tech ifp school mba groupe ecole suprieure de commerce et de management
bhaskara-varma-namburi-82b153171,senior test analyst ivy,experienced test analyst demonstrated history working information technology services industry skilled uipath selenium webdriver maven functional testing bdd framework robot framework git lab source tree version one domains life sciences investment banking sports betting,senior test analyst ivy experienced test analyst demonstrated history working information technology services industry skilled uipath selenium webdriver maven functional testing bdd framework robot framework git lab source tree version one domains life sciences investment banking sports betting
aldin-john-coquilla-b07200113,business performance coordinator,find job line course apply knowledge skills gain work experience different fields become valuable person future,business performance coordinator find job line course apply knowledge skills gain work experience different fields become valuable person future
farah-irtahi-70a64885,electronic engineer,telecommunications engineering graduate knowledge area wireless communications techniques g g lte rf design optimization radio network transmission systems microwave optic fibre design planning well data networks systems high experience low current systems security sytems cctv smatv public address nursing call card radars gate barrier access control intercom systems availability uae immediate hold valid uae visa converted transferred full uae driving licence,electronic engineer telecommunications engineering graduate knowledge area wireless communications techniques g g lte rf design optimization radio network transmission systems microwave optic fibre design planning well data networks systems high experience low current systems security sytems cctv smatv public address nursing call card radars gate barrier access control intercom systems availability uae immediate hold valid uae visa converted transferred full uae driving licence
farooq-kavupadath-2a166b130,accountant wearmart,emerging accounting professional ready develop career foundation expanding operation dedicated keeping records accurate controls tight meet business needssystematic wellorganized strong attention detail accounting software including ms navish software,accountant wearmart emerging accounting professional ready develop career foundation expanding operation dedicated keeping records accurate controls tight meet business needssystematic wellorganized strong attention detail accounting software including ms navish software
usamasuhailquddusi,assistant manager pak suzuki power user sap supply chain enthusiast techno commercial procurement ned mitx,innovative industrious talented mechanical engineer proven track record learning new skills since graduating mechanical engineering degree postgraduate degree masters engineering management industrial management ned university moreover also completed micromasters supply chain management mit usa edx communicative encouraging team player presents ideas effectively able assist others latest procedures skilled planning procurement negotiation imports costing duties sro monitoring supply chain management large number technical packages quickly surpassed expectations erp well endtoend project management,assistant manager pak suzuki power user sap supply chain enthusiast techno commercial procurement ned mitx innovative industrious talented mechanical engineer proven track record learning new skills since graduating mechanical engineering degree postgraduate degree masters engineering management industrial management ned university moreover also completed micromasters supply chain management mit usa edx communicative encouraging team player presents ideas effectively able assist others latest procedures skilled planning procurement negotiation imports costing duties sro monitoring supply chain management large number technical packages quickly surpassed expectations erp well endtoend project management
morten-klementsen-71b68919,digital artist norway nfts,hello linkediners morten outgoing energetic creative soul years experience behind various industries regardless industry always motto top mind get give motto given lot joy work well privately start communication zero text youre ok im ok whether directors laundry helpers get synergies absolutely essential joint happiness success approx year ago discovered ai digital art hooked field ever since got good press coverage contract agent company paris france anything help send inmail txt wonderful day ahead remember live,digital artist norway nfts hello linkediners morten outgoing energetic creative soul years experience behind various industries regardless industry always motto top mind get give motto given lot joy work well privately start communication zero text youre ok im ok whether directors laundry helpers get synergies absolutely essential joint happiness success approx year ago discovered ai digital art hooked field ever since got good press coverage contract agent company paris france anything help send inmail txt wonderful day ahead remember live
roc%C3%ADo-g%C3%B3mez-juncal-37b1832a,teaching staff unir university internet,socioeducational facilitator trainer field education basic psychology organizer socioeducational events since extensive experience linking educational business social fields experience development training material,teaching staff unir university internet socioeducational facilitator trainer field education basic psychology organizer socioeducational events since extensive experience linking educational business social fields experience development training material
stanleyhuang-,product manager seagate,hi im stanley professional experiences led intersection technology business product management hardwarefirmware design internships experienced firsthand products life cycle goal develop technical customer focus product design skills support team obstacles,product manager seagate hi im stanley professional experiences led intersection technology business product management hardwarefirmware design internships experienced firsthand products life cycle goal develop technical customer focus product design skills support team obstacles
pinilla-cuenca-liz-adriana-20142924,quality manager frigorfico guadalupe,professional experience implementation maintenance integrated management systems manufacturing companies skills design planning activities execution plans programs monitoring results ensure achievement objectives highly achievementoriented practical orientation reasoning approaches contribute achievement results ability work teams leadership creativity dynamism execution activities,quality manager frigorfico guadalupe professional experience implementation maintenance integrated management systems manufacturing companies skills design planning activities execution plans programs monitoring results ensure achievement objectives highly achievementoriented practical orientation reasoning approaches contribute achievement results ability work teams leadership creativity dynamism execution activities
ken-hoffman-553587101,real estate broker,nothing provides team greater satisfaction helping clients realized early industry happy clients make happy realize need real estate professional listen understands industry positioned stay ahead game constantly researching latest technologies tools services ensure clients benefit best marketing search products help sale purchase home pride negotiating skills allow clients interests represented best possible way get absolute best price buying home selling keep much equity wealth possible relationships residential mortgage lending loan structuring allow clients best options suit needs financial objectives mostly truly enjoy opportunity work great people help achieve dreams team tumas understands sellers buyers want real estate transaction professional courteous service youre thinking moving know anyone getting ready buy sell rent please put touch remember team tumas work three times hard meet real estate needs awards certificationsworking coldwell banker franchise state illinoisworking coldwell banker franchise northern regionworking coldwell banker franchise nationmember national association realtors state association realtors local multiple listing service boardprofessionally trained satisfy real estate needscommitted delivering exceptional serviceken hoffman illinois indiana licensed real estate broker,real estate broker nothing provides team greater satisfaction helping clients realized early industry happy clients make happy realize need real estate professional listen understands industry positioned stay ahead game constantly researching latest technologies tools services ensure clients benefit best marketing search products help sale purchase home pride negotiating skills allow clients interests represented best possible way get absolute best price buying home selling keep much equity wealth possible relationships residential mortgage lending loan structuring allow clients best options suit needs financial objectives mostly truly enjoy opportunity work great people help achieve dreams team tumas understands sellers buyers want real estate transaction professional courteous service youre thinking moving know anyone getting ready buy sell rent please put touch remember team tumas work three times hard meet real estate needs awards certificationsworking coldwell banker franchise state illinoisworking coldwell banker franchise northern regionworking coldwell banker franchise nationmember national association realtors state association realtors local multiple listing service boardprofessionally trained satisfy real estate needscommitted delivering exceptional serviceken hoffman illinois indiana licensed real estate broker
deanthroop,cloud solutions engineer intel corporation,teach anyone interested encrypt phone im andor email communications endtoend results oriented professional extensive project management team leadership experience led nontechnical teams large cashiers walmarts back school technical teams individuals designed deployed maintained various computer networks windows linux bsd apple trained c programming proficient languages including python sql php development efforts include designing developing web based erp system manufacture order facility helped architect implement revolutionary means execute live streaming virtual reality vr events recently built blinky light hello world electronics,cloud solutions engineer intel corporation teach anyone interested encrypt phone im andor email communications endtoend results oriented professional extensive project management team leadership experience led nontechnical teams large cashiers walmarts back school technical teams individuals designed deployed maintained various computer networks windows linux bsd apple trained c programming proficient languages including python sql php development efforts include designing developing web based erp system manufacture order facility helped architect implement revolutionary means execute live streaming virtual reality vr events recently built blinky light hello world electronics
janet-ramsey-347bab71,assistant contact manager city kent,enthusiastically highly motivated professional approximately years experience within phase clinical research approach hard working customer focused individual able work independently crossfunctional teams contact manager city kent group working within guys st thomas trust helping lead dedicated team includes new cancer centre guys hospital also slimming world consultant group opens th march,assistant contact manager city kent enthusiastically highly motivated professional approximately years experience within phase clinical research approach hard working customer focused individual able work independently crossfunctional teams contact manager city kent group working within guys st thomas trust helping lead dedicated team includes new cancer centre guys hospital also slimming world consultant group opens th march
valentina-kaneva-64927b114,mrs valentina kaneva,years nanny london,mrs valentina kaneva years nanny london
philips-parker-294b8ba7,family solicitor mediator,accomplished highly commercial client orientated collaborative family lawyer mediator genuine passion practice area equally comfortable mediating negotiating litigating across international client base offer solid track record best clients specialties law society family law panel member law society family mediation panel full practitioner member direct consultation children provider collaborative lawyer neighbour mediator professional practice consultant ppc,family solicitor mediator accomplished highly commercial client orientated collaborative family lawyer mediator genuine passion practice area equally comfortable mediating negotiating litigating across international client base offer solid track record best clients specialties law society family law panel member law society family mediation panel full practitioner member direct consultation children provider collaborative lawyer neighbour mediator professional practice consultant ppc
tarun-seth,senior research analyst digital marketing google operations center,maximizing analytical reporting project management digital marketing skills thereby contributing towards challenging work environment experienced demonstrated history working executive search market research information technology media industry skilled secondary market research research analyst data quality analyst excel reports powerpoint presentations etc httpswwwyoutubecomchanneluczkovwpgqwtrihqznw,senior research analyst digital marketing google operations center maximizing analytical reporting project management digital marketing skills thereby contributing towards challenging work environment experienced demonstrated history working executive search market research information technology media industry skilled secondary market research research analyst data quality analyst excel reports powerpoint presentations etc httpswwwyoutubecomchanneluczkovwpgqwtrihqznw
dbeales,technical analyst rochester software associates,engineering professional extensive experience design development technical product support training expertise computers software applications electronics output printing devices printing system workflows several years experience technical support center operations focused problem analysis delivering solutions customers field technical personnel thirdparty software developers specialties problem analysis customer satisfaction technical awareness unix pc systems training design delivery web site implementation,technical analyst rochester software associates engineering professional extensive experience design development technical product support training expertise computers software applications electronics output printing devices printing system workflows several years experience technical support center operations focused problem analysis delivering solutions customers field technical personnel thirdparty software developers specialties problem analysis customer satisfaction technical awareness unix pc systems training design delivery web site implementation
salmangilani,business analyst requirement engineer product owner agile methodologies jira azure,strategic results driven business analyst years wide range experience complex bb enterprise level software development integration projects eu usa based companies recognized visionary creative thinker strong analytical skills equipped comprehensive strategic planning implementation skills innovative problem solver ability see business technical sides problem proven leadership negotiation abilities exceptional communication skills oral written improved teamwork work ethics record accomplishments commitment towards profession based upon following work ethics contributing effectively realize companys objectives even go extra mile achieve demonstrating behavior sets high standards ones work performing efficiently face adversity disappointment resistance skills asis tobe analysis user experience usability analysis process modelling requirements engineering data analysis business intelligence bi reports stakeholder analysis gap analysis atlassian products azure boards expertprocess customization use case activity diagrams integration functional gui regression testing,business analyst requirement engineer product owner agile methodologies jira azure strategic results driven business analyst years wide range experience complex bb enterprise level software development integration projects eu usa based companies recognized visionary creative thinker strong analytical skills equipped comprehensive strategic planning implementation skills innovative problem solver ability see business technical sides problem proven leadership negotiation abilities exceptional communication skills oral written improved teamwork work ethics record accomplishments commitment towards profession based upon following work ethics contributing effectively realize companys objectives even go extra mile achieve demonstrating behavior sets high standards ones work performing efficiently face adversity disappointment resistance skills asis tobe analysis user experience usability analysis process modelling requirements engineering data analysis business intelligence bi reports stakeholder analysis gap analysis atlassian products azure boards expertprocess customization use case activity diagrams integration functional gui regression testing
donna-bianchi-06,administrative receptionist fresenius medical care north america sewell nj,highly proficient detail oriented tenured administrativeexecutive assistantmarketing support associate years supporting senior level management extensive capability administrative operations event planning front desk reception proficient microsoft office proven high level integrity confidentiality strong work ethic experience working fastpaced environment excellent interpersonal organizational analytical technical skills goal results oriented highly motivated flexible able multitask efficiently dedicated passionate job company work positive attitude enjoy working people part team able work independently willing learn whatever takes job,administrative receptionist fresenius medical care north america sewell nj highly proficient detail oriented tenured administrativeexecutive assistantmarketing support associate years supporting senior level management extensive capability administrative operations event planning front desk reception proficient microsoft office proven high level integrity confidentiality strong work ethic experience working fastpaced environment excellent interpersonal organizational analytical technical skills goal results oriented highly motivated flexible able multitask efficiently dedicated passionate job company work positive attitude enjoy working people part team able work independently willing learn whatever takes job
clint-peters-a140519b,regional manager african spear,experienced general manager demonstrated history working financial services industry skilled negotiation budgeting business relationship management operations management risk management strong sales professional bachelors degree focused business administration management general university free stateuniversiteit van die vrystaat,regional manager african spear experienced general manager demonstrated history working financial services industry skilled negotiation budgeting business relationship management operations management risk management strong sales professional bachelors degree focused business administration management general university free stateuniversiteit van die vrystaat
valentin-rubio-399b4a235,student university western brittany,graduated professional license field gerontology years experience manager home care association decided resume training master dsms order improve skills direct towards management medicosocial structures particularly field helping elderly,student university western brittany graduated professional license field gerontology years experience manager home care association decided resume training master dsms order improve skills direct towards management medicosocial structures particularly field helping elderly
frank-mercer-23120aa0,janitorialhousekeeping,cleans equipment surgical areas storage areas furniture beds cleans spills flooded areas deep clean sanitize rooms mattresses vents bathrooms showers operates electrical cleaning equipment strips cleans polish floors wall surfaces vacuum carpet areas dilutes cleaning solutions collect dispose linen waste including biohazard medical waste upholds policies procedures,janitorialhousekeeping cleans equipment surgical areas storage areas furniture beds cleans spills flooded areas deep clean sanitize rooms mattresses vents bathrooms showers operates electrical cleaning equipment strips cleans polish floors wall surfaces vacuum carpet areas dilutes cleaning solutions collect dispose linen waste including biohazard medical waste upholds policies procedures
david-rowan-674164115,general manager prop,experienced director logistics demonstrated history working events services industry prop strive high customer engagement satisfaction seeking understand objectives designing solutions benefiting mutual outcomes skilled management teamwork microsoft office social media social media marketing constant staff training innovative products collaborating internal external teams ensure successful events strong operations professional graduated dn laoghaire institute art design technology,general manager prop experienced director logistics demonstrated history working events services industry prop strive high customer engagement satisfaction seeking understand objectives designing solutions benefiting mutual outcomes skilled management teamwork microsoft office social media social media marketing constant staff training innovative products collaborating internal external teams ensure successful events strong operations professional graduated dn laoghaire institute art design technology
lubberspatrick,clinical informaticist intersection healthcare ict innovation,clinical informaticist enjoy working intersection healthcare processes ict connector bridge builder worlds healthcare professionals patients organizations transmural collaboration make digital innovations actually work practice thus advance healthcare driven passion part improve healthcare drive gives energy colleagues describe enthusiastic driven committed connecting resultsoriented creative clinical informaticist shy away challenge role advisor information manager project leader program manager,clinical informaticist intersection healthcare ict innovation clinical informaticist enjoy working intersection healthcare processes ict connector bridge builder worlds healthcare professionals patients organizations transmural collaboration make digital innovations actually work practice thus advance healthcare driven passion part improve healthcare drive gives energy colleagues describe enthusiastic driven committed connecting resultsoriented creative clinical informaticist shy away challenge role advisor information manager project leader program manager
brent-hawks-a3341813a,phd candidate forestry virginia tech,currently phd student forestry virginia tech working project evaluating impact forestry best management practices bmps forest water quality postharvest,phd candidate forestry virginia tech currently phd student forestry virginia tech working project evaluating impact forestry best management practices bmps forest water quality postharvest
jillian-metterhausen-48419714,assistant director guest services swag,jobs may seem varied given ability experience many different skills within one company allowed better assistance across entire company able fill needed help others may unavailable love variety organized chaos hospitality gives swag unique hospitality offers find great joy giving best ensure guests absolutely amazing time specific specialties adobe photoshop illustrator indesign acrobat quarkxpress microsoft word excel powerpoint mac pc platforms managing updating websites wordpress poster design brochure design wine liqueur bottle design newsletter design magazine design logo design bookbinding,assistant director guest services swag jobs may seem varied given ability experience many different skills within one company allowed better assistance across entire company able fill needed help others may unavailable love variety organized chaos hospitality gives swag unique hospitality offers find great joy giving best ensure guests absolutely amazing time specific specialties adobe photoshop illustrator indesign acrobat quarkxpress microsoft word excel powerpoint mac pc platforms managing updating websites wordpress poster design brochure design wine liqueur bottle design newsletter design magazine design logo design bookbinding
